{
  "questionType": "mcq",
  "stimulus": {
    "type": "table",
    "text": "Agricultural researchers hypothesized that drip irrigation provides a larger yield advantage over sprinkler irrigation when conditions are dry than when they are wet. To test this, they cultivated the same variety of tomato in matched plots irrigated by each method during three growing seasons that differed in rainfall, recording the average yield per plant for each combination of season and method. The researchers concluded that ______",
    "tableJson": {
      "caption": "Average tomato yield (kilograms per plant) by growing season and irrigation method",
      "columns": [
        "Growing season",
        "Drip irrigation",
        "Sprinkler irrigation"
      ],
      "rows": [
        [
          "Dry",
          6.8,
          4.2
        ],
        [
          "Moderate",
          7.1,
          6.2
        ],
        [
          "Wet",
          7.5,
          7
        ]
      ]
    },
    "diagram": null
  },
  "stem": "Which choice most effectively uses data from the table to complete the statement?",
  "choices": [
    {
      "id": "A",
      "text": "in the dry season, drip-irrigated plants yielded 6.8 kilograms per plant compared with 4.2 kilograms for sprinkler-irrigated plants—a gap of 2.6 kilograms, far larger than the 0.5-kilogram gap in the wet season.",
      "misconceptionId": null
    },
    {
      "id": "B",
      "text": "the advantage of drip irrigation over sprinkler irrigation was greatest in the wet season, when drip-irrigated plants yielded 7.5 kilograms per plant and sprinkler-irrigated plants yielded 7.0 kilograms.",
      "misconceptionId": "SAT_RW:command-evidence-quantitative-trend-reversal"
    },
    {
      "id": "C",
      "text": "in the dry season, sprinkler-irrigated plants yielded 6.8 kilograms per plant compared with 4.2 kilograms for drip-irrigated plants, the largest difference between methods observed in any season.",
      "misconceptionId": "SAT_RW:command-evidence-quantitative-table-misread"
    },
    {
      "id": "D",
      "text": "drip irrigation was consistently productive, never yielding less than 6.8 kilograms per plant in any of the three growing seasons.",
      "misconceptionId": "SAT_RW:command-evidence-quantitative-irrelevant-data"
    }
  ],
  "correctAnswer": "A",
  "rationale": "The hypothesis concerns the size of drip irrigation's advantage over sprinkler irrigation in dry versus wet conditions, so the completion must compare the between-method gaps. In the dry season the gap is 6.8 − 4.2 = 2.6 kilograms per plant; in the wet season it is 7.5 − 7.0 = 0.5 kilograms. The dry-condition advantage is much larger, exactly as hypothesized, and Choice A states this with numbers that match the table. Choice C swaps the two methods' dry-season values, attributing the 6.8 figure to sprinkler and the 4.2 figure to drip, which inverts what the table shows. Choice B cites accurate wet-season values but calls that the greatest advantage; the 0.5-kilogram wet-season gap is in fact the smallest of the three, so it reverses the comparison the claim requires. Choice D is numerically accurate—6.8 kilograms is indeed drip irrigation's lowest seasonal yield—but it says nothing about how drip compares with sprinkler across conditions, so it cannot support the hypothesis.",
  "difficultyTarget": 3,
  "id": "gen-sat-rw-command-evidence-quantitative-001",
  "subjectCode": "SAT_RW",
  "taxonomyCode": "SAT_RW:command-evidence-quantitative",
  "provenance": {
    "archetypeSlug": "command-evidence-quantitative",
    "promptVersion": "1.2.0",
    "model": "k3",
    "generatedAt": "2026-08-31T23:21:08.735Z",
    "contentHash": "bd23e7aa739179baa76e7d07690dbc7d76cb93d0870336300fb3133ec449c3f0"
  },
  "review": {
    "status": "pending",
    "reviewer": null,
    "notes": null
  },
  "allowedUses": [
    "display"
  ],
  "variantOf": null
}
