{
  "questionType": "mcq",
  "stimulus": {
    "type": "passage",
    "text": "Researchers monitoring tide pools along a rocky coastline found that in pools where sea otters were regularly present, sea urchins were scarce. In pools from which sea otters were absent, sea urchins were abundant, and the seaweed that forms the base of the pool ecosystem was markedly sparse. Sea urchins are known to feed on seaweed. Taken together, these findings indicate that ______.",
    "tableJson": null,
    "diagram": null
  },
  "stem": "Which choice most logically completes the text?",
  "choices": [
    {
      "id": "A",
      "text": "sparse seaweed in some tide pools caused sea otters to abandon those pools",
      "misconceptionId": "SAT_RW:inferences-wrong-direction"
    },
    {
      "id": "B",
      "text": "sea otters are the sole factor determining the abundance of sea urchins in tide pools",
      "misconceptionId": "SAT_RW:inferences-overreach"
    },
    {
      "id": "C",
      "text": "sea urchins in tide pools feed on the seaweed that forms the base of the pool ecosystem",
      "misconceptionId": "SAT_RW:inferences-restatement-trap"
    },
    {
      "id": "D",
      "text": "sea otters help sustain seaweed in these pools by keeping sea urchin populations low",
      "misconceptionId": null
    }
  ],
  "correctAnswer": "D",
  "rationale": "The inference requires combining the premises: otters present → urchins scarce; otters absent → urchins abundant and seaweed sparse; and urchins eat seaweed. The conclusion the premises jointly support is that otters, by suppressing urchins, help sustain the seaweed — a claim matched to the evidence in both scope and certainty (C). Choice C merely restates the premise that urchins eat seaweed rather than drawing a conclusion from all three premises together (restatement trap). Choice B inflates the supported claim into an absolute: the observations link otter presence to low urchin numbers, but nothing rules out other influences, so 'sole factor' overreaches. Choice A reverses the direction the premises establish: the pattern links otter absence to the subsequent abundance of urchins and sparse seaweed; it does not show seaweed scarcity driving otters away, and nothing in the passage addresses why otters leave a pool.",
  "difficultyTarget": 3,
  "id": "gen-sat-rw-inferences-001",
  "subjectCode": "SAT_RW",
  "taxonomyCode": "SAT_RW:inferences",
  "provenance": {
    "archetypeSlug": "inferences",
    "promptVersion": "1.1.0",
    "model": "k3",
    "generatedAt": "2026-08-31T20:24:23.624Z",
    "contentHash": "ac53df92107cd21ef1b6053ecb30e1efe0bff66ff13b37991f768eed56054b5b"
  },
  "review": {
    "status": "pending",
    "reviewer": null,
    "notes": null
  },
  "allowedUses": [
    "display"
  ],
  "variantOf": null
}
